{
  "schema_version": "1.0",
  "id": "agent-runtime-loop",
  "kind": "pipeline",
  "question": "一次 Agent 动作里，MCP、Memory 与参数约束分别在哪一层发生作用？",
  "takeaway": "Memory 决定什么历史进入当前上下文，模型决定下一步意图，Tool Schema 先限制参数形状，Runtime 再做授权与业务检查，MCP/本地工具只执行已经通过这些边界的调用；工具结果随后回流，并且只有值得未来复用的信息才写入长期 Memory。",
  "reading_order": "从左到右看一次动作：先组装上下文，再让模型选动作；注意 Schema 与 Runtime Policy 是两个不同关口，最后才到 MCP/工具执行与结果回流。",
  "boundary": "这是教学用运行环，不等价于某个 SDK 的内部调用栈；具体实现可以合并或拆分步骤，但不能把参数校验当成授权，也不能把 MCP 当成 Memory。",
  "evidence_type": "schematic",
  "steps": [
    {
      "id": "context",
      "label": "① 组装 Context",
      "detail": "用户输入 + 当前 Session 历史 + 检索到的长期 Memory，组成这一轮模型真正能看到的上下文。",
      "tone": "info"
    },
    {
      "id": "decide",
      "label": "② 模型选择下一步",
      "detail": "模型可以直接回答，也可以选择一个本地工具或由 MCP 暴露的工具，并生成结构化参数。",
      "tone": "neutral"
    },
    {
      "id": "schema",
      "label": "③ Tool Schema 收窄参数",
      "detail": "required、enum、范围、格式等约束先回答“参数长得是否合法”，不负责判断调用者有没有权限。",
      "tone": "success"
    },
    {
      "id": "policy",
      "label": "④ Runtime Policy 决定能否执行",
      "detail": "Guardrail、审批、Authorization、资源状态与幂等性继续回答“这一次动作是否真的允许发生”。",
      "tone": "warn"
    },
    {
      "id": "tool",
      "label": "⑤ MCP / 本地工具执行",
      "detail": "通过检查后，Host 才把调用交给对应的 MCP Server 或本地函数；协议只负责接能力，不替代业务正确性。",
      "tone": "info"
    },
    {
      "id": "result",
      "label": "⑥ 结果回流并选择性写 Memory",
      "detail": "结构化结果重新进入模型上下文；完成任务后，只把未来仍有价值的事实、偏好或经验写入长期 Memory。",
      "tone": "success"
    }
  ]
}
